{"result":"completed","action":"translate","table":"ruqyah_details","files_processed":["ruqyah_details_053.json"],"first_chunk":53,"last_chunk":53,"verification_passed":true,"token_pressure":"medium","recommended_delay_hours":2,"next_action":"After at least 2 hours, translate and fully review ruqyah_details_054.json only; do not begin postponed book work.","summary":"Translated and fully reviewed both entries in ruqyah_details_053.json, covering three case narratives and the complete raqi qualifications. Added precise review evidence, updated PLAN.md and WORK_STATUS.md, and marked the chunk done. Closing status reports ruqyah_details at 53/95 chunks.","corrections":["Repaired the mechanically split “p…erson” sentence in English row 106 and documented the decision in GLOSSARY.json.","Excluded unrelated Bengali rows after checking their conflicting category/subcategory routing.","Restored the omitted narrator subject in row 105 and refined headings, agreement, pronouns, and sentence flow.","Final verification passed; target-only scans found no blanks, Bengali residue, unintended Latin prose, replacement characters, or non-ASCII digits."]}