{"result":"completed","action":"review","table":"duas","files_processed":["work/duas/duas_026.json","work/duas/duas_027.json","work/duas/duas_028.json","work/duas/duas_029.json","work/duas/duas_030.json"],"first_chunk":26,"last_chunk":30,"verification_passed":true,"token_pressure":"medium","recommended_delay_hours":1,"next_action":"Freshly review duas_031.json through duas_035.json; keep books and book_details postponed.","summary":"Freshly reviewed all 243 user-visible targets in chunks 026–030. Corrected Urdu accuracy and naturalness, updated GLOSSARY.json, PLAN.md, REVIEW_026_030.md, and regenerated WORK_STATUS.md. All five chunks are marked done and passed separate verification; no Bengali or unintended Latin prose remains.","corrections":["Attributed row 331’s categorical land-vehicle warning to the source author and clarified the Safa sequence in nested row 345.","Replaced unnatural spitting wording in rows 352, 356, and 371; row 356 now accurately reflects the prayer context in [Muslim 2203a](https://sunnah.com/muslim:2203a).","Corrected row 372 from “سب سے بلند اور سب سے قریب” to “وہی ظاہر ہے اور وہی باطن,” following the Arabic and [Abu Dawud 5110](https://sunnah.com/abudawud:5110).","Retitled row 376 as a teaching about controlling anger while preserving required numeral #2.","Corrected row 409’s title to seek Paradise and deliverance from Hell."]}