{"result":"completed","action":"translate","table":"ruqyah_instants","files_processed":["work/ruqyah_instants/ruqyah_instants_006.json"],"first_chunk":6,"last_chunk":6,"verification_passed":true,"token_pressure":"medium","recommended_delay_hours":2,"next_action":"After at least 2 hours, translate and fully review only work/ruqyah_instants/ruqyah_instants_007.json. Do not begin postponed book work.","summary":"Translated and naturally reviewed IDs 70–88: 19 entries and 61 target fields. Per-file verification and residual-language scans passed; REVIEW_RUQYAH_INSTANTS_006.md, PLAN.md, GLOSSARY.json, and WORK_STATUS.md were updated. Status is now 6/20 ruqyah_instants chunks done.","corrections":["Row 70 omits the unsupported “in all the worlds” phrase after checking [Bukhari 3370](https://sunnah.com/bukhari:3370).","Rows 74 and 78 preserve the general requests and correct divine meanings, following [Abu Dawud 1495](https://sunnah.com/abudawud:1495) and [Abu Dawud 1493](https://sunnah.com/abudawud:1493).","Row 88 correctly begins “Our Lord is Allah” before shifting to direct address, following [Abu Dawud 3892](https://sunnah.com/abudawud:3892).","Recorded all four genuine source conflicts as field-specific glossary overrides."]}