{"result":"completed","action":"review","table":"duas","files_processed":["duas_021.json","duas_022.json","duas_023.json","duas_024.json","duas_025.json"],"first_chunk":21,"last_chunk":25,"verification_passed":true,"token_pressure":"medium","recommended_delay_hours":2,"next_action":"Freshly review duas_026.json through duas_030.json; keep books and book_details postponed.","summary":"Freshly reviewed 57 entries and 188 user-visible strings, including nested group text. Updated durable review evidence, PLAN.md, GLOSSARY.json, and WORK_STATUS.md. All five chunks remain done and passed separate verification.","corrections":["Naturalized instructions, recitation wording, titles, and respectful forms of address.","Aligned row 294 with the supplied Arabic sequence and attributed row 310’s broad usage advice to the source author.","Corrected row 277 against [Quran 87](https://quran.com/87/6-9), row 318 against [Tirmidhi 3446](https://sunnah.com/tirmidhi:3446), and nested row 319 against [Muslim 1342](https://sunnah.com/muslim:1342).","Residual scans found no Bengali text, replacement characters, non-ASCII digits, or unintended Latin prose."]}