{"result":"completed","action":"translate","table":"ruqyah_details","files_processed":["work/ruqyah_details/ruqyah_details_052.json","GLOSSARY.json","PLAN.md","REVIEW_RUQYAH_DETAILS_052.md","WORK_STATUS.md"],"first_chunk":52,"last_chunk":52,"verification_passed":true,"token_pressure":"medium","recommended_delay_hours":2,"next_action":"After at least 2 hours, translate and fully review ruqyah_details_053.json only; do not begin postponed book work.","summary":"Translated and fully reviewed row 104, covering the complete introduction and five treatments for نظرِ بد. Added durable review evidence and regenerated workspace status; ruqyah_details now stands at 52/95 chunks.","corrections":["Restored the washing sequence and blessing instruction from Muwatta Malik 50:2.","Corrected the crossed-hand washing direction and normalized malformed citation names without changing reference numbers.","Aligned the displayed ruqyah meanings with Muslim 2185–2186 and removed the unsupported “heal me” wording from the final supplication.","Verified preserved Arabic, transliterations, HTML, numbers, IDs, nullness, and ordering; scans found no Bengali or unintended Latin prose."]}