{"result":"completed","action":"review","table":"duas","files_processed":["duas_021.json","duas_022.json","duas_023.json","duas_024.json","duas_025.json"],"first_chunk":21,"last_chunk":25,"verification_passed":true,"token_pressure":"medium","recommended_delay_hours":2,"next_action":"Review duas_026.json through duas_030.json next. Leave postponed books/book_details and untranslated chunk 040 untouched.","summary":"Reviewed 57 rows and 166 Urdu target fields, improved naturalness, resolved source conflicts, created REVIEW_021_025.md, updated PLAN.md, and regenerated WORK_STATUS.md. All five chunks pass separately.","corrections":["Corrected row 273’s nafth wording from witchcraft to spitting using Abu Dawud 775.","Restored row 283’s omitted instruction to name the intended matter during istikhara.","Corrected row 320’s reversed traveler/farewell-giver direction.","Matched row 324’s plural Arabic speaker and retitled row 311 to reflect fasting intention.","Documented why row 318 follows Tirmidhi 3446 rather than the supplied bracketed variant.","Final scans found no Bengali, replacement characters, non-ASCII digits, or unintended Latin prose."]}