{"result":"completed","action":"translate","table":"ruqyah_instants","files_processed":["work/ruqyah_instants/ruqyah_instants_007.json","GLOSSARY.json","PLAN.md","REVIEW_RUQYAH_INSTANTS_007.md","WORK_STATUS.md"],"first_chunk":7,"last_chunk":7,"verification_passed":true,"token_pressure":"medium","recommended_delay_hours":4,"next_action":"After at least 4 hours, translate and fully review only work/ruqyah_instants/ruqyah_instants_012.json. Do not begin postponed book work.","summary":"Translated and naturally reviewed all 48 target fields for IDs 89–104. The final audit reports ruqyah_instants at 11/20 chunks and identifies chunk 012 as next; the overall project remains incomplete.","corrections":["Reused established Urdu for reviewed parallel passages.","Recorded eight field-specific source-conflict decisions in GLOSSARY.json.","Checked Abu Dawud 3107 for row 97’s prayer variant and Quran 67:5 for row 98.","Per-file verification passed: 16 entries and 48 translated fields.","Target scans found no blanks, Bengali residue, unintended Latin prose, non-ASCII digits, or replacement characters."]}