{"result":"completed","action":"translate","table":"duas","files_processed":["work/duas/duas_061.json","work/duas/duas_062.json","work/duas/duas_063.json"],"first_chunk":61,"last_chunk":63,"verification_passed":true,"token_pressure":"medium","recommended_delay_hours":2,"next_action":"After at least 2 hours, translate and fully review only work/duas/duas_064.json. Do not work on postponed books or book_details.","summary":"Translated and fully reviewed dua rows 907–979 in natural Pakistani Urdu. Added precise REVIEW_061_063.md evidence, updated PLAN.md and GLOSSARY.json, and regenerated WORK_STATUS.md; duas now stands at 63/64 chunks.","corrections":["Corrected windstorm/rain meanings and the duplicated source clause in rows 909–912.","Restored accurate Arabic contrasts and cited narration context in rows 920, 932, and 936.","Restored omitted supplied content in row 943 and the meanings of al-Muqaddim/al-Mu'akhkhir in row 960.","Each chunk passed scripts/verify.py separately; scans found no Bengali residue, unintended Latin prose, replacement characters, or non-ASCII digits."]}