{"result":"completed","action":"translate","table":"ruqyah_instants","files_processed":["work/ruqyah_instants/ruqyah_instants_013.json","GLOSSARY.json","PLAN.md","REVIEW_RUQYAH_INSTANTS_013.md","WORK_STATUS.md"],"first_chunk":13,"last_chunk":13,"verification_passed":true,"token_pressure":"medium","recommended_delay_hours":2,"next_action":"After at least 2 hours, translate and fully review only work/ruqyah_instants/ruqyah_instants_014.json; do not begin postponed book work.","summary":"Translated and naturally reviewed IDs 190–200 across 33 target fields. The closing audit now reports 13/20 ruqyah_instants chunks done and chunk 014 as next.","corrections":["Reused six complete reviewed Quranic translations and the reviewed Ar-Rahman 55:33–36 subsection exactly.","Rendered داعي الله in row 190 as “اللہ کی طرف بلانے والا” and documented the English conflict.","Omitted explanatory English-bracket names from rows 190 and 196.","Naturalized Al-Baqarah 2:165–167 for tense, relationships, and spoken flow.","Per-file verification passed with no blank targets, Bengali residue, unintended Latin prose, non-ASCII digits, or replacement characters."]}